{
  "specVersion": "0.1",
  "id": "org.example.fixture",
  "name": "Manifest fixture",
  "engine": "javascript",
  "entry": "scripts/main.js",
  "permissions": {
    "network": [
      "https://api.example.invalid"
    ],
    "cookies": true,
    "storage": false
  },
  "capabilities": {
    "operations": [
      "home"
    ],
    "host": [
      "cookies"
    ]
  }
}
