{
  "specVersion": "0.1",
  "id": "org.example.fixture",
  "name": "Manifest fixture",
  "engine": "declarative",
  "entry": "source.json",
  "permissions": {
    "network": [
      "https://media.example.invalid"
    ],
    "cookies": false,
    "storage": false
  },
  "capabilities": {
    "operations": [
      "play"
    ],
    "host": []
  }
}
